{
  "schema_version": "funding-story-template-v1",
  "id": "t06_trust_maintenance_full_campaign",
  "template_name": "로봇청소기 신뢰·유지관리형 전체 캠페인",
  "category": "테크·가전",
  "language": "ko",
  "generation_source": "manual-analysis",
  "media_profile_ref": "robotic-floor-cleaner-v1",
  "target": "성능의 검증 상태와 유지관리·서비스 범위를 우선 확인하는 로봇청소기 사용자",
  "default_word_count": 2200,
  "narration_mode": "trust_maintenance_full_campaign",
  "style": {
    "tone_keywords": [
      "신중함",
      "투명함",
      "관리중심"
    ],
    "sentence_style": "검증된 사실, 메이커 진술, 미확인 정보를 문단 안에서 명확히 구분",
    "visual_mood": "제품 관리 상태와 근거 범위를 차분하게 검토할 수 있는 신뢰 중심 테크 캠페인",
    "color_palette": [
      "#0F172A",
      "#0F766E",
      "#F0FDFA"
    ],
    "font_style": "Sans-serif",
    "typography": "검증 상태와 조건은 표와 보조 문장으로 분리하고 과도한 강조를 피함",
    "urgency_style": "제공된 일정·수량이 없으면 긴급성 문구를 사용하지 않음",
    "cta_style": "검증 상태와 유지관리·서비스 조건을 확인한 뒤 참여를 안내"
  },
  "content_strategy": {
    "core_message": "시험·인증·관리·서비스 정보를 출처 상태와 함께 제시하고 확인되지 않은 유지관리 효과나 지원 약속은 만들지 않는다.",
    "product_keywords": [
      "로봇청소기",
      "유지관리",
      "신뢰",
      "시험조건",
      "서비스"
    ],
    "success_metrics": [
      "자체 시험과 외부 인증 구분",
      "관리 범위와 예외 표시",
      "서비스 약속의 입력 근거 확인"
    ],
    "emphasis_phrases": {
      "trust": [
        "증빙 유형과 적용 범위를 함께 표시",
        "인증·후기·전문가 평가는 입력이 있을 때만 사용"
      ],
      "maintenance": [
        "자동 관리와 수동 관리 범위를 구분",
        "소모품·세척 주기는 입력값만 사용"
      ],
      "service": [
        "A/S 기간과 범위를 제공된 조건으로만 표시",
        "미래 지원 약속 생성 금지"
      ],
      "project": [
        "생산·배송·리스크 대응은 입력값만 사용",
        "미확인 항목은 검토 필요로 표시"
      ]
    }
  },
  "layout": [
    {
      "id": "hero",
      "label": "히어로",
      "type": "intro",
      "summary": "대표 성능과 제품 정체성을 첫 화면에서 제시",
      "expected_content": "제품명, 제품 유형, 대표 성능·조건, 핵심 기능과 타깃을 입력 사실로 요약",
      "visual_hint": "참조 제품 본체와 도크를 유지한 밝은 가로 제품 사진과 편집 가능한 제목 여백",
      "content_type": "image_full_overlay",
      "image_required": true,
      "overlay_content": "{{headline}} · {{verified_performance}}",
      "html_content": "<section class=\"hero\"><h1>{{headline}}</h1><p>{{verified_summary}}</p><ul>{{key_features}}</ul></section>",
      "html_structure": "full-width hero followed by verified feature list"
    },
    {
      "id": "problem",
      "label": "문제 제기",
      "type": "problem",
      "summary": "타깃이 해결하려는 청소 부담을 입력 범위 안에서 정의",
      "expected_content": "AUDIENCE와 명시된 PROBLEM만 사용하며 시장 전체나 위생 효과를 일반화하지 않음",
      "visual_hint": "문제별 짧은 목록과 충분한 여백. 미제공 불편은 만들지 않음",
      "content_type": "problem_list",
      "image_required": false,
      "overlay_content": null,
      "html_content": "<section class=\"problem\"><h2>{{problem_heading}}</h2><ul>{{supported_problem_items}}</ul></section>",
      "html_structure": "problem heading with evidence-bounded list"
    },
    {
      "id": "solution",
      "label": "솔루션",
      "type": "solution",
      "summary": "확인된 기능을 타깃의 요구와 연결",
      "expected_content": "FEATURE·FACT·CLAIM ID를 사용해 청소·물걸레·센서·도크 기능과 조건을 설명하고 미검증 효과는 제외",
      "visual_hint": "참조 제품 외형만 유지한 실제 사용 공간의 가로 이미지와 편집 가능한 본문 여백",
      "content_type": "image_solution_list",
      "image_required": true,
      "overlay_content": "{{solution_heading}}",
      "html_content": "<section class=\"solution\"><h2>{{solution_heading}}</h2><p>{{solution_summary}}</p><ul>{{verified_solution_items}}</ul></section>",
      "html_structure": "solution image followed by verified feature list"
    },
    {
      "id": "features",
      "label": "주요 기능·구성",
      "type": "feature",
      "summary": "주요 기능과 확인된 구성만 정리",
      "expected_content": "FEATURE와 FACT를 표·목록으로 정리하고 리워드 구성품이 없으면 미입력 사실을 표시",
      "visual_hint": "추가 구성품 없이 참조 제품 본체와 도크만 보여 주는 가로 제품 이미지",
      "content_type": "image_feature_table",
      "image_required": true,
      "overlay_content": "{{features_heading}}",
      "html_content": "<section class=\"features\"><h2>{{features_heading}}</h2><table>{{verified_feature_rows}}</table></section>",
      "html_structure": "feature image followed by editable feature table"
    },
    {
      "id": "social_proof",
      "label": "신뢰·검증",
      "type": "evidence",
      "summary": "시험·인증·후기·메이커 배경을 출처 상태와 함께 구분",
      "expected_content": "EVIDENCE와 CLAIM을 연결하고 인증·전문가 평가·후기가 없으면 생성하지 않음",
      "visual_hint": "증빙 유형과 적용 범위를 나타내는 편집 가능한 목록",
      "content_type": "evidence_list",
      "image_required": true,
      "overlay_content": null,
      "html_content": "<section class=\"evidence\"><h2>{{trust_heading}}</h2><ul>{{evidence_items}}</ul></section>",
      "html_structure": "evidence list without fabricated quotation"
    },
    {
      "id": "funding_plan",
      "label": "펀딩금 사용 계획",
      "type": "funding_plan",
      "summary": "메이커가 제공한 펀딩금 사용 항목·비율을 표로 제시",
      "expected_content": "사용 계획 입력이 없으면 비율과 용도를 만들지 않고 필요한 입력 항목만 표시",
      "visual_hint": "제공된 값만 포함하는 편집 가능한 사용 계획 표",
      "content_type": "funding_plan_table",
      "image_required": false,
      "overlay_content": null,
      "html_content": "<section class=\"funding-plan\"><h2>{{funding_heading}}</h2><table>{{provided_funding_rows}}</table></section>",
      "html_structure": "funding plan table or missing-input notice"
    },
    {
      "id": "platform_choice",
      "label": "플랫폼 선택 이유",
      "type": "platform_choice",
      "summary": "메이커가 제공한 와디즈 선택 이유를 설명",
      "expected_content": "선택 이유가 입력되지 않았으면 메이커 의도·성과·커뮤니티 효과를 추정하지 않음",
      "visual_hint": "제공된 선택 이유를 짧은 목록으로 배치",
      "content_type": "platform_reason_list",
      "image_required": false,
      "overlay_content": null,
      "html_content": "<section class=\"platform-choice\"><h2>{{platform_heading}}</h2><ul>{{provided_reasons}}</ul></section>",
      "html_structure": "maker-provided platform reason list"
    },
    {
      "id": "timeline",
      "label": "개발·생산 일정",
      "type": "timeline",
      "summary": "개발·생산·발송 일정을 입력값으로만 구성",
      "expected_content": "SCHEDULE_POLICY와 일정 출처를 사용하고 미입력 기간·미래 공지 약속을 만들지 않음",
      "visual_hint": "날짜와 상태를 수정할 수 있는 세로 타임라인",
      "content_type": "project_timeline",
      "image_required": false,
      "overlay_content": null,
      "html_content": "<section class=\"timeline\"><h2>{{timeline_heading}}</h2><ol>{{provided_schedule}}</ol></section>",
      "html_structure": "editable schedule timeline or missing-input notice"
    },
    {
      "id": "team",
      "label": "메이커·팀",
      "type": "team",
      "summary": "제공된 팀 규모·경험·개발 기간을 역할별 추정 없이 소개",
      "expected_content": "CLAIM과 FACT로 확인된 팀 정보만 사용하고 개인별 경력·직책은 입력이 있을 때만 표시",
      "visual_hint": "검증된 팀 정보와 미입력 역할을 구분한 목록",
      "content_type": "team_list",
      "image_required": true,
      "overlay_content": null,
      "html_content": "<section class=\"team\"><h2>{{team_heading}}</h2><ul>{{verified_team_items}}</ul></section>",
      "html_structure": "team fact list without inferred roles"
    },
    {
      "id": "risks",
      "label": "리스크·대응",
      "type": "risk",
      "summary": "메이커가 제공한 공급·생산·일정 리스크와 대응만 정리",
      "expected_content": "대응 계획이 없으면 공급업체·QA 조직·업데이트 약속을 만들지 않고 미입력 사실을 표시",
      "visual_hint": "리스크와 대응을 분리한 편집 가능한 목록 또는 표",
      "content_type": "risk_table",
      "image_required": false,
      "overlay_content": null,
      "html_content": "<section class=\"risks\"><h2>{{risk_heading}}</h2><table>{{provided_risk_rows}}</table></section>",
      "html_structure": "risk-response table or missing-input notice"
    },
    {
      "id": "cta",
      "label": "참여 안내",
      "type": "cta",
      "summary": "확인된 제품 가치와 검토 필요 정보를 바탕으로 참여를 안내",
      "expected_content": "검증된 기능을 짧게 요약하고 미제공 가격·수량·마감 긴급성을 만들지 않음",
      "visual_hint": "제품 핵심 가치와 검토 안내를 담는 단순한 마무리 배너",
      "content_type": "cta_banner",
      "image_required": false,
      "overlay_content": null,
      "html_content": "<section class=\"cta\"><h2>{{cta_heading}}</h2><p>{{verified_cta}}</p></section>",
      "html_structure": "verified-value CTA without artificial urgency"
    }
  ]
}
